[
  {
    "Source": "Leakbase[.]la",
    "Content": "#Germany Database Leak",
    "author": " (Dc419)",
    "Detection Date": "10 Jul 2025",
    "Type": "Data leak"
  },
  {
    "Source": "Leakbase[.]la",
    "Content": "[Rare Leaked] Linkedin Full Data 2021, 2022, 2023 35M Lines {Useful 14M}",
    "author": " (JustinMc)",
    "Detection Date": "10 Jul 2025",
    "Type": "Data leak"
  },
  {
    "Source": "https://www.blackhatworld.com/",
    "Content": "Agency run ads for leads recovery",
    "author": " (Ultimate18)",
    "Detection Date": "10 Jul 2025",
    "Type": "Data leak"
  },
  {
    "Source": "https://www.blackhatworld.com/",
    "Content": "⚡ 31 Million HTTP/S & SOCKS 4/5 Residential IP's Backconnect Private Proxies ⚡",
    "author": " (ShifterIO)",
    "Detection Date": "10 Jul 2025",
    "Type": "Data leak"
  },
  {
    "Source": "https://www.blackhatworld.com/",
    "Content": "Offer Free Review Copy for ❤️⚡【THE Witcher SEO PACKAGE】⚡ ❤️",
    "author": " (ProPrimeServices)",
    "Detection Date": "10 Jul 2025",
    "Type": "Data leak"
  },
  {
    "Source": "https://www.blackhatworld.com/",
    "Content": "Anyone ran recovery/chargeback ads on le without cloaking for more than a week?",
    "author": " (zed1337)",
    "Detection Date": "10 Jul 2025",
    "Type": "Data leak"
  },
  {
    "Source": "https://www.blackhatworld.com/",
    "Content": "❤️ BACKLINKSFUL SEO 2024 ❤️ BOOST RANKINGS IN ANY NICHE✅ FLAT 20% OFF ✅LOW PRICE HQ LINKS▶️Paid Indexers",
    "author": " (backlinksful)",
    "Detection Date": "10 Jul 2025",
    "Type": "Data leak"
  },
  {
    "Source": "https://www.blackhatworld.com/",
    "Content": "Newbie here",
    "author": " (knightz005)",
    "Detection Date": "10 Jul 2025",
    "Type": "Data leak"
  },
  {
    "Source": "https://www.blackhatworld.com/",
    "Content": "Spotting Fake Marketplace Reviews",
    "author": " (Zwielicht)",
    "Detection Date": "10 Jul 2025",
    "Type": "Data leak"
  },
  {
    "Source": "https://www.blackhatworld.com/",
    "Content": "NULLTRACE.SU :: ANONYMOUS DOMAIN REGISTRAR | BLACKLIST CHECKER | CRYPTO PAYMENTS ONLY",
    "author": " (NULLTRACE)",
    "Detection Date": "10 Jul 2025",
    "Type": "Data leak"
  },
  {
    "Source": "https://www.blackhatworld.com/",
    "Content": "NULLTRACE.SU :: OFFSHORE VPS | UNLIMITED TRAFFIC | CRYPTO PAYMENTS",
    "author": " (NULLTRACE)",
    "Detection Date": "10 Jul 2025",
    "Type": "Data leak"
  },
  {
    "Source": "https://www.blackhatworld.com/",
    "Content": "NULLTRACE.SU :: BULLETPROOF FASTFLUX | SPAMHAUS & ALL ABUSES IGNORED | CRYPTO PAYMENTS",
    "author": " (NULLTRACE)",
    "Detection Date": "10 Jul 2025",
    "Type": "Data leak"
  },
  {
    "Source": "https://gerki.pw/",
    "Content": "11ML USA COMBO",
    "author": "",
    "Detection Date": "10 Jul 2025",
    "Type": "Data leak"
  },
  {
    "Source": "https://www.blackhatworld.com/",
    "Content": "[THE PBN backlinks]⚡RED DEAD REDEMPTION⚡ ✅ Rank Up Your Website with PBN Backlinks ⏭ Get High-Quality (DA) 30+ PBN Backlinks✅",
    "author": " (Setro Seo)",
    "Detection Date": "10 Jul 2025",
    "Type": "Data leak"
  },
  {
    "Source": "https://www.blackhatworld.com/",
    "Content": "Read This Before You Pick A Username",
    "author": " (Zwielicht)",
    "Detection Date": "10 Jul 2025",
    "Type": "Data leak"
  },
  {
    "Source": "https://www.blackhatworld.com/",
    "Content": "How to Post a Marketplace Thread",
    "author": " (iModBot)",
    "Detection Date": "10 Jul 2025",
    "Type": "Data leak"
  },
  {
    "Source": "https://www.blackhatworld.com/",
    "Content": "I Will Craft You a Super High ROI Viral Video Website - Just Like the Ones Rich Marketers Have",
    "author": " (Vere)",
    "Detection Date": "10 Jul 2025",
    "Type": "Data leak"
  },
  {
    "Source": "https://www.blackhatworld.com/",
    "Content": "✅ Buy Trustpilot Reviews – Fully Verified ⭐ GEO-Targeted ⭐ Replacement Guarantee ⭐",
    "author": " (RK)",
    "Detection Date": "10 Jul 2025",
    "Type": "Data leak"
  },
  {
    "Source": "https://www.blackhatworld.com/",
    "Content": "⭐⭐⭐....5⭐le My Business & le Review ⭐✅❤Trustpilot Review⭐✅❤Facebook Review⭐✅❤All Types Of Links⭐✅❤Any Country & Language.....⭐⭐⭐",
    "author": " (apumondol1)",
    "Detection Date": "10 Jul 2025",
    "Type": "Data leak"
  },
  {
    "Source": "https://www.blackhatworld.com/",
    "Content": "⭐ AgedProfiles.com ➡️ [GET] HQ, PVA, AGED YOUTUBE ACCOUNTS [2005 - 2023+] ✅ INSTANT DELIVERY!",
    "author": " (agedaccs)",
    "Detection Date": "10 Jul 2025",
    "Type": "Data leak"
  },
  {
    "Source": "https://www.blackhatworld.com/",
    "Content": "SEO",
    "author": " (Serpcrafter)",
    "Detection Date": "10 Jul 2025",
    "Type": "Data leak"
  },
  {
    "Source": "https://www.blackhatworld.com/",
    "Content": "FACEBOOK, TIKTOK ADVERTISING ACCOUNT FOR RENT - (BM, PERSONAL) -✅UNLIMITED QUANTITY, ✅UNLIMITED SPENDING, ✅ACCEPT BH, GH, WH, ✅24/7 SUPPORT",
    "author": " (John Willusa)",
    "Detection Date": "10 Jul 2025",
    "Type": "Data leak"
  },
  {
    "Source": "https://www.blackhatworld.com/",
    "Content": "Can I REALLY run CC Submit offers? Or is that a trap for beginners?",
    "author": " (Regina Vera)",
    "Detection Date": "10 Jul 2025",
    "Type": "Data leak"
  },
  {
    "Source": "https://www.blackhatworld.com/",
    "Content": "▶️ SocAutoPoster.com ◀️ Social Media Automation Tool✨AI✨Cross-posting⚡Content Parser ❇️ FB, Telegram, YouTube, IG, Pinterest, TikTok, X,...",
    "author": " (SocAutoPoster)",
    "Detection Date": "10 Jul 2025",
    "Type": "Data leak"
  },
  {
    "Source": "https://www.blackhatworld.com/",
    "Content": "Happy Birthday, Legend!",
    "author": " (TheMarquis)",
    "Detection Date": "10 Jul 2025",
    "Type": "Data leak"
  },
  {
    "Source": "https://www.blackhatworld.com/",
    "Content": "anybody tried this startegy?",
    "author": " (vijaypoco6)",
    "Detection Date": "10 Jul 2025",
    "Type": "Data leak"
  },
  {
    "Source": "https://www.blackhatworld.com/",
    "Content": "✅ le Ads Agency Accounts For Black and White Niches + $480 Promotion",
    "author": " (amanguy)",
    "Detection Date": "10 Jul 2025",
    "Type": "Data leak"
  },
  {
    "Source": "https://hard-tm.su/",
    "Content": "Слив с приватки",
    "author": " (rd6fsxfen5th)",
    "Detection Date": "10 Jul 2025",
    "Type": "Data leak"
  },
  {
    "Source": "https://hard-tm.su/",
    "Content": "Приватный чит Blaze для Escape from Tarkov",
    "author": " (Xpyst)",
    "Detection Date": "10 Jul 2025",
    "Type": "Data leak"
  },
  {
    "Source": "https://hard-tm.su/",
    "Content": "Приватный чит для EFT - Moonshine Hyper-V [AIM, ESP, MISC]",
    "author": " (Xpyst)",
    "Detection Date": "10 Jul 2025",
    "Type": "Data leak"
  },
  {
    "Source": "https://hard-tm.su/",
    "Content": "EFT Collapse[AIM, ESP, MISC]- Тихий, Смертельный, Невидимый!",
    "author": " (Xpyst)",
    "Detection Date": "10 Jul 2025",
    "Type": "Data leak"
  },
  {
    "Source": "Leakbase[.]la",
    "Content": "DB Orange, Bouyges",
    "author": " (BeamBruno)",
    "Detection Date": "10 Jul 2025",
    "Type": "Data leak"
  },
  {
    "Source": "Leakbase[.]la",
    "Content": "French combolist and StockX Databases",
    "author": " (Sworz)",
    "Detection Date": "10 Jul 2025",
    "Type": "Data leak"
  },
  {
    "Source": "https://www.blackhatworld.com/",
    "Content": "Anyone got GMB Listings that I can buy in USA, New York City?",
    "author": " (kevacy)",
    "Detection Date": "10 Jul 2025",
    "Type": "Data leak"
  },
  {
    "Source": "https://www.blackhatworld.com/",
    "Content": "Need Door repair and Garage Door sites",
    "author": " (vikir)",
    "Detection Date": "10 Jul 2025",
    "Type": "Data leak"
  },
  {
    "Source": "https://www.blackhatworld.com/",
    "Content": "✅FACEBOOK ADS ACCOUNTS FOR RENT ‍CLOAKING TECHNIQUE ‍NO SPENDING LIMIT ‍FEE 4-8% ‍ ‍SMART PIXEL ‍ SUPPORT 24/7✅",
    "author": " (TVN Agency)",
    "Detection Date": "10 Jul 2025",
    "Type": "Data leak"
  },
  {
    "Source": "https://www.blackhatworld.com/",
    "Content": "NewIPNow.com: ✅ Self-Service Private Proxies ✅ Instant IP Refresh ✅ Just $0.88/IP + $0.00/GB ⭐Get +50% FREE⭐",
    "author": " (IPXPRT)",
    "Detection Date": "10 Jul 2025",
    "Type": "Data leak"
  },
  {
    "Source": "https://www.blackhatworld.com/",
    "Content": "⭐ Buy Trustpilot Reviews ⭐ Actual Verified Reviews ⭐ GUARANTEED LE PAGE 1 ✅ POSSIBLY THE BEST ORM SERVICE ON BHW",
    "author": " (INCC)",
    "Detection Date": "10 Jul 2025",
    "Type": "Data leak"
  },
  {
    "Source": "https://www.blackhatworld.com/",
    "Content": "⭐ Premium FB Ad Accounts | No Verification Needed | Run All Campaign Types | 24/7 Expert Support + Smart Proxy ⭐",
    "author": " (UpAdz)",
    "Detection Date": "10 Jul 2025",
    "Type": "Data leak"
  },
  {
    "Source": "https://www.blackhatworld.com/",
    "Content": "[Exclusive Offer] Make Tons Of Money With A Complete eCommerce or Dropshipping Store ★ Starting from $250 ★",
    "author": " (wecreative)",
    "Detection Date": "10 Jul 2025",
    "Type": "Data leak"
  },
  {
    "Source": "https://www.blackhatworld.com/",
    "Content": "Need a messaging bot for Psychology Today",
    "author": " (jonzelinski)",
    "Detection Date": "10 Jul 2025",
    "Type": "Data leak"
  },
  {
    "Source": "https://www.blackhatworld.com/",
    "Content": "✅ PREMIUM LE ADS AGENCY ACCOUNTS ✅ RENT & SCALE WITH HIGH-SPEND, FULL VERIFIED ACCOUNTS ✅ ALLOW ALL TYPE ADS ✅",
    "author": " (UpAdz)",
    "Detection Date": "10 Jul 2025",
    "Type": "Data leak"
  },
  {
    "Source": "https://hard-tm.su/",
    "Content": "Супермикс со сливов с большим хайдом №9",
    "author": " (DontWorry)",
    "Detection Date": "10 Jul 2025",
    "Type": "Data leak"
  },
  {
    "Source": "https://hard-tm.su/",
    "Content": "Студентка наяривает пиписёк",
    "author": " (DontWorry)",